<?xml version="1.0"?>
<!DOCTYPE attd SYSTEM "attd.dtd">
<?xml-stylesheet type="text/xsl" href="attd.xsl"?>
<attd xmlns:xsi="http://www.w3.org/2001/XMLSchema-instance"
xsi:noNamespaceSchemaLocation="attd.xsd">
	<attd_stat>
		<date>18-8-11</date>
		<hour>1</hour>
		<rollno>42</rollno>
		<status>present</status>
	</attd_stat>
	<attd_stat>
		<date>18-8-11</date>
		<hour>1</hour>
		<rollno>43</rollno>
		<status>absent</status>
	</attd_stat>
	<attd_stat>
		<date>18-8-11</date>
		<hour>1</hour>
		<rollno>44</rollno>
		<status>present</status>
	</attd_stat>
	<attd_stat>
		<date>18-8-11</date>
		<hour>2</hour>
		<rollno>42</rollno>
		<status>present</status>
	</attd_stat>
	<attd_stat>
		<date>18-8-11</date>
		<hour>2</hour>
		<rollno>43</rollno>
		<status>present</status>
	</attd_stat>
	<attd_stat>
		<date>18-8-11</date>
		<hour>2</hour>
		<rollno>44</rollno>
		<status>absent</status>
	</attd_stat>
	<attd_stat>
		<date>19-8-11</date>
		<hour>1</hour>
		<rollno>42</rollno>
		<status>absent</status>
	</attd_stat>
	<attd_stat>
		<date>19-8-11</date>
		<hour>1</hour>
		<rollno>43</rollno>
		<status>absent</status>
	</attd_stat>
	<attd_stat>
		<date>19-8-11</date>
		<hour>1</hour>
		<rollno>44</rollno>
		<status>present</status>
	</attd_stat>
	<attd_stat>
		<date>19-8-11</date>
		<hour>2</hour>
		<rollno>42</rollno>
		<status>present</status>
	</attd_stat>
	<attd_stat>
		<date>19-8-11</date>
		<hour>2</hour>
		<rollno>43</rollno>
		<status>absent</status>
	</attd_stat>
	<attd_stat>
		<date>19-8-11</date>
		<hour>2</hour>
		<rollno>44</rollno>
		<status>present</status>
	</attd_stat>
</attd>